url,id,genres,tags,specs,price
http://store.steampowered.com/app/269270/LOVE/,269270,action  indie,platformer  indie  pixel graphics  retro  great soundtrack  action  short  minimalist  difficult  2d  singleplayer,singleplayer  steam achievements  steam trading cards  partial controller support  steam leaderboards  includes level editor,2.99
http://store.steampowered.com/app/436653/Rocksmith_2014__Brooks__Dunn__Only_In_America/,436653,casual  simulation,casual  simulation,singleplayer  shared/split screen  downloadable content  steam achievements  steam trading cards  partial controller support  steam cloud  steam leaderboards,2.99
http://store.steampowered.com/app/592460/Shadow_Warrior_2_Bounty_Hunt_DLC_Part_1/,592460,action  adventure,action  violent  adventure  gore,singleplayer  coop  online coop  downloadable content  steam achievements  full controller support  steam trading cards  steam cloud,Free
http://store.steampowered.com/app/215852/Magic_2014_Dodge_and_Burn_Foil_Conversion/,215852,strategy,strategy,singleplayer  multiplayer  coop  shared/split screen  downloadable content  steam achievements  partial controller support  steam cloud  stats  steam leaderboards,0.99
http://store.steampowered.com/app/717020/Drosoph_Hotel/,717020,adventure  indie  simulation  strategy  early access,early access  strategy  indie  simulation  adventure,singleplayer  steam achievements,15.99
http://store.steampowered.com/app/453920/The_Last_Witch_Hunter/,453920,no info available,movie  supernatural  action  fantasy  actionadventure,captions available,3.99
http://store.steampowered.com/app/407200/Dungeon_of_the_Endless__Rescue_Team_Addon/,407200,adventure  indie  rpg  strategy,strategy  adventure  rpg  indie,singleplayer  multiplayer  online multiplayer  coop  online coop  crossplatform multiplayer  downloadable content  steam achievements  steam trading cards  partial controller support  steam cloud,1.99
http://store.steampowered.com/app/295081/Rocksmith_2014__Jimi_Hendrix_Song_Pack_III/,295081,casual  simulation,casual  simulation,singleplayer  shared/split screen  downloadable content  steam achievements  steam trading cards  partial controller support  steam cloud  steam leaderboards,7.99
http://store.steampowered.com/app/708920/I_Can_See_the_Future/,708920,action  indie,action  indie  topdown  violent  topdown shooter  fastpaced  arcade  2d  difficult  actionadventure  atmospheric  singleplayer,singleplayer  steam achievements  steam cloud  steam leaderboards,3.99
http://store.steampowered.com/app/636930/Soundscape__Demo_Edition/,636930,no info available,free to play  vr  music,singleplayer  htc vive  oculus rift  tracked motion controllers  seated  standing  roomscale,Free To Play
http://store.steampowered.com/app/417851/Hyperdimension_Neptunia_U_Difficult_Quest/,417851,action  rpg,action  rpg,singleplayer  downloadable content  full controller support,0.99
http://store.steampowered.com/app/206089/Rocksmith__Tone_Customization__Time_Saver_Pack/,206089,casual  simulation,casual  simulation,singleplayer  shared/split screen  downloadable content,4.99
http://store.steampowered.com/app/267778/Talisman__Character_Pack_9__Shape_Shifter/,267778,indie  rpg  strategy,strategy  rpg  indie,singleplayer  multiplayer  downloadable content  steam achievements  steam trading cards  steam cloud  steam leaderboards,1.99
http://store.steampowered.com/app/542190/AIRHEART__The_Bonus_Content/,542190,action  indie,action  indie,singleplayer  downloadable content,2.99
http://store.steampowered.com/app/582578/XPlane_11__Addon_Aerosoft__Airport_Zurich_V2/,582578,simulation,simulation,singleplayer  online multiplayer  local multiplayer  downloadable content,29.99
http://store.steampowered.com/app/304350/Wildlife_Park_2/,304350,casual  indie  simulation  strategy,simulation  strategy  casual  indie  management  sandbox  realistic  economy  family friendly,singleplayer,6.99
http://store.steampowered.com/app/493760/Fairyland_Incursion/,493760,adventure  indie  rpg,adventure  rpg  indie  rpgmaker  board game  multiplayer  anime,singleplayer  coop  local coop  shared/split screen  steam achievements  steam trading cards,2.99
http://store.steampowered.com/app/457820/Outrage/,457820,adventure  indie  rpg,indie  rpg  adventure  rpgmaker  cyberpunk,singleplayer  steam achievements  steam trading cards  partial controller support,3.99
http://store.steampowered.com/app/635810/Manygolf/,635810,casual  free to play  massively multiplayer  sports,free to play  sports  massively multiplayer  casual  golf,online multiplayer,Cooming Soon
http://store.steampowered.com/app/528057/Tales_of_Berseria__Japanese_Fairy_and_Menagerie_Costumes_Set/,528057,action  rpg,action  rpg,singleplayer  shared/split screen  downloadable content  steam achievements  full controller support  steam trading cards  steam cloud,9.99
http://store.steampowered.com/app/619010/Arkaia_The_Enigmatic_Isle/,619010,adventure  indie,adventure  indie,singleplayer  steam achievements,1.99
http://store.steampowered.com/app/294974/Rocksmith_2014__Biffy_Clyro__Many_of_Horror/,294974,casual  simulation,casual  simulation,singleplayer  shared/split screen  downloadable content  steam achievements  steam trading cards  partial controller support  steam cloud  steam leaderboards,2.99
http://store.steampowered.com/app/509680/Rocksmith_2014_Edition__Remastered__Creedence_Clearwater_Revival__Fortunate_Son/,509680,casual  simulation,casual  simulation,singleplayer  shared/split screen  downloadable content  steam achievements  steam trading cards  partial controller support  steam cloud  steam leaderboards,2.99
http://store.steampowered.com/app/708930/Dice/,708930,casual  indie  simulation,indie  casual  simulation,singleplayer  online multiplayer,0.99
http://store.steampowered.com/app/632190/Invisigun_Heroes__Soundtrack/,632190,action  casual  free to play  indie  strategy,strategy  action  free to play  indie  casual,singleplayer  multiplayer  online multiplayer  local multiplayer  shared/split screen  crossplatform multiplayer  downloadable content  steam achievements  full controller support  steam trading cards  steam cloud,3.99
http://store.steampowered.com/app/208801/Tomb_Raider_Animal_Instinct/,208801,action  adventure,action  adventure,singleplayer  multiplayer  downloadable content  steam achievements  full controller support,0.99
http://store.steampowered.com/app/368680/Super_Mutant_Alien_Assault/,368680,action  indie,action  indie  local coop  pixel graphics  platformer  roguelike,singleplayer  local coop  steam achievements  full controller support  steam trading cards  steam leaderboards,9.99
http://store.steampowered.com/app/550930/Rocket_Craze_3D/,550930,action  adventure  simulation,simulation  action  adventure  space  shooter  space sim,singleplayer  steam achievements  full controller support,3.99
http://store.steampowered.com/app/444590/Shrouded_in_Sanity/,444590,action  adventure  indie  rpg,action  indie  adventure  rpg  pixel graphics  psychological horror  lovecraftian  difficult,singleplayer  steam achievements  full controller support,5.99
http://store.steampowered.com/app/281780/Super_Motherload_Soundtrack/,281780,adventure  casual  indie  rpg,rpg  indie  casual  adventure,singleplayer  multiplayer  shared/split screen  downloadable content  steam achievements  full controller support,4.99
http://store.steampowered.com/app/716080/Trouble_Witches_Originadditional_character__Louis/,716080,action  indie,action  indie,singleplayer  downloadable content  steam achievements  full controller support  steam trading cards  steam leaderboards,2.49
http://store.steampowered.com/app/373020/Blender_Game_Asset_Creation/,373020,no info available,animation & modeling  game development  tutorial  gaming,no info available,9.99
http://store.steampowered.com/app/720130/Fantasy_Grounds__DD_Xanathars_Guide_to_Everything/,720130,indie  rpg  strategy,strategy  indie  rpg  sandbox  partybased rpg  utilities  online coop  software  fantasy  turnbased,multiplayer  online multiplayer  coop  online coop  crossplatform multiplayer  downloadable content,29.99
http://store.steampowered.com/app/527402/Honey_Rose__Humble_Tier/,527402,action  adventure  indie  strategy,strategy  action  adventure  indie,singleplayer  downloadable content  steam achievements  full controller support  steam trading cards,4.99
http://store.steampowered.com/app/316750/Tetris_Ultimate/,316750,casual,casual  puzzle,singleplayer  multiplayer  steam achievements  partial controller support,14.99
http://store.steampowered.com/app/624540/Fantasy_Grounds__More_Monsters_3_Token_Pack/,624540,indie  rpg  strategy,strategy  rpg  indie,multiplayer  coop  crossplatform multiplayer  downloadable content,4.99
http://store.steampowered.com/app/471410/Zenodyne_R__Soundtrack/,471410,action  indie,action  indie,singleplayer  downloadable content  steam achievements  partial controller support,4.99
http://store.steampowered.com/app/696400/NeoBoom/,696400,casual  indie  strategy,strategy  indie  casual,singleplayer  steam achievements  steam trading cards,0.99
http://store.steampowered.com/app/627670/Rocket_Wars/,627670,action  indie,action  indie  local multiplayer  great soundtrack,singleplayer  local multiplayer  local coop  shared/split screen  steam achievements  full controller support  steam trading cards  steam cloud  stats,7.99
http://store.steampowered.com/app/432720/Welkin_Road/,432720,action  adventure  indie  early access,early access  action  adventure  indie  parkour,singleplayer  steam achievements  steam trading cards  partial controller support  steam cloud  stats  steam leaderboards,12.99
http://store.steampowered.com/app/450090/Fantasy_Grounds__TopDown_Tokens__Darkwoulfes_Token_Pack_Vol_2/,450090,indie  rpg  strategy,strategy  rpg  indie,multiplayer  coop  crossplatform multiplayer  downloadable content,4.99
http://store.steampowered.com/app/593970/Clash_of_Vessels_VR/,593970,no info available,strategy  action  casual  simulation  vr,singleplayer  htc vive  tracked motion controllers  seated  standing  roomscale,3.99
http://store.steampowered.com/app/356123/HIS__Avatar_XF5U_Pack/,356123,action  casual  free to play  rpg  simulation  strategy,strategy  action  rpg  casual  simulation  free to play,singleplayer  multiplayer  coop  downloadable content  partial controller support,19.99
http://store.steampowered.com/app/27800/Space_Giraffe/,27800,indie,psychedelic  arcade  score attack  abstract,singleplayer,9.99
http://store.steampowered.com/app/206500/AirMech_Strike/,206500,action  free to play  indie  strategy  early access,early access  free to play  strategy  multiplayer  mechs  moba  action  rts  indie  robots  online coop  scifi  coop  massively multiplayer  pvp  shooter  adventure  singleplayer  fastpaced  rpg,singleplayer  multiplayer  online multiplayer  coop  online coop  steam achievements  steam trading cards  partial controller support  stats  steam leaderboards,Free to Play
http://store.steampowered.com/app/674700/Interplanetary_OST/,674700,strategy,strategy,singleplayer  downloadable content,4.99
http://store.steampowered.com/app/559170/Ready_Aim_Splat/,559170,no info available,action  indie  casual  vr,singleplayer  htc vive  oculus rift  tracked motion controllers  standing  roomscale,4.99
http://store.steampowered.com/app/764070/Franky_the_Bumwalker_Teleportation/,764070,action  adventure  casual  indie,action  adventure  indie  casual,singleplayer  downloadable content,0.99
http://store.steampowered.com/app/387230/Badland_Bandits__Early_Access_Base_Pack/,387230,action  massively multiplayer  racing  rpg  simulation,action  rpg  massively multiplayer  simulation  racing,multiplayer  downloadable content  steam achievements  steam trading cards,6.99
http://store.steampowered.com/app/737990/Friday_the_13th_The_Game__Jason_Part_4_Pig_Splitter_Kill_Pack/,737990,action,action  violent  gore,multiplayer  downloadable content  steam achievements  full controller support  stats  steam leaderboards,2.99
http://store.steampowered.com/app/277763/Train_Simulator_Grand_Central_Class_180_Adelante_DMU_AddOn/,277763,simulation,simulation  open world  sandbox  realistic  family friendly  physics  trains  trackir  atmospheric,singleplayer  downloadable content  steam achievements  full controller support  steam trading cards  steam workshop  steam cloud  steam leaderboards,19.99
http://store.steampowered.com/app/403230/ZombieZoid_Zenith/,403230,action  adventure  indie,action  adventure  indie  zombies,singleplayer  steam achievements  full controller support  steam trading cards  steam cloud,5.99
http://store.steampowered.com/app/685570/TurretMaster/,685570,indie  strategy  early access,early access  strategy  indie,singleplayer  stats  includes level editor,2.99
http://store.steampowered.com/app/215004/Victoria_II_Interwar_Engineer_Unit/,215004,strategy,strategy,singleplayer  multiplayer  downloadable content,1.99
http://store.steampowered.com/app/31820/Nancy_Drew_The_Haunted_Carousel/,31820,adventure,adventure  point & click  mystery  female protagonist  puzzle  detective,singleplayer,6.99
http://store.steampowered.com/app/631900/Airtone/,631900,no info available,action  adventure  vr  rhythm  music,singleplayer  steam achievements  htc vive  oculus rift  tracked motion controllers  seated  standing  roomscale,29.99
http://store.steampowered.com/app/446990/The_Huntsman_Winters_Curse/,446990,adventure  casual  indie  rpg,adventure  rpg  indie  casual  visual novel  card game  female protagonist  story rich  handdrawn  fantasy  great soundtrack  turnbased tactics  tactical  movie  partybased rpg  free to play  jrpg,singleplayer  steam achievements  steam trading cards,Free to Play
http://store.steampowered.com/app/639070/Dropzone__Pilot_Pack_Threshing_Trio/,639070,action  free to play  strategy,strategy  action  free to play,singleplayer  multiplayer  online multiplayer  coop  online coop  downloadable content  steam achievements  steam trading cards  inapp purchases,9.99
http://store.steampowered.com/app/258366/Rocksmith_2014__Green_Day__American_Idiot/,258366,casual  simulation,casual  simulation,singleplayer  shared/split screen  downloadable content  steam achievements  steam trading cards  partial controller support  steam cloud  steam leaderboards,2.99
http://store.steampowered.com/app/658790/Samurai_Riot/,658790,action  adventure  indie,adventure  action  indie  beat 'em up  2d,singleplayer  local multiplayer  local coop  shared/split screen  full controller support  steam cloud,14.99
http://store.steampowered.com/app/389912/Fantasy_Grounds__Top_Down_Tokens__Heroic_6/,389912,indie  rpg  strategy,indie  rpg  strategy,multiplayer  coop  crossplatform multiplayer  downloadable content,4.99
http://store.steampowered.com/app/215830/Closers/,215830,action  free to play  massively multiplayer  rpg  early access,early access  anime  action  massively multiplayer  rpg  hack and slash  free to play  beat 'em up  side scroller,singleplayer  multiplayer  online multiplayer  mmo  coop  online coop  steam trading cards  inapp purchases  partial controller support,Free To Play
http://store.steampowered.com/app/571690/FaceRig_Studio__Personal/,571690,animation &amp; modeling  video production,animation & modeling  video production,no info available,299.99
http://store.steampowered.com/app/768950/Quest_Hunter_Original_Soundtrack/,768950,action  adventure  indie  rpg,rpg  indie  adventure  music  soundtrack  great soundtrack  online coop  singleplayer  controller  choices matter  loot  action  action rpg  story rich  third person  coop  atmospheric  replay value  cartoon  magic,singleplayer  coop  online coop  local coop  shared/split screen  downloadable content  steam achievements  full controller support  steam trading cards  steam cloud  stats  steam leaderboards,4.99
http://store.steampowered.com/app/437900/Party_Jousting/,437900,casual  free to play  indie  sports,free to play  casual  indie  sports  multiplayer  local multiplayer  2d,multiplayer  local multiplayer  shared/split screen  full controller support,Free to Play
http://store.steampowered.com/app/537157/FourChords_Guitar_Karaoke__James_Blunt_Song_Pack/,537157,casual  indie  simulation,indie  casual  simulation,singleplayer  downloadable content  steam achievements  full controller support  steam trading cards,4.99
http://store.steampowered.com/app/568150/Technoball/,568150,action  casual  indie  sports,action  indie  casual  sports,singleplayer  local multiplayer  local coop  shared/split screen  steam achievements  steam trading cards  partial controller support,2.99
http://store.steampowered.com/app/624990/The_Mimic/,624990,action  adventure  casual  indie,indie  action  casual  adventure,singleplayer  local multiplayer  coop  local coop  shared/split screen  full controller support,14.99
http://store.steampowered.com/app/326033/TS_Marketplace_DR_Komfortwagen_Coach_Pack/,326033,simulation,simulation,singleplayer  downloadable content  steam achievements  full controller support  steam trading cards  steam workshop  steam cloud  steam leaderboards,4.99
http://store.steampowered.com/app/289280/El_Matador/,289280,action,action  third person  bullet time  shooter  thirdperson shooter  singleplayer,singleplayer,3.99
http://store.steampowered.com/app/523840/RunGunJumpGun__SoundtrackSpecial_Edition_Upgrade/,523840,action  indie,action  indie,singleplayer  downloadable content  steam achievements  full controller support  steam trading cards  steam cloud,1.99
http://store.steampowered.com/app/455020/Jackpot_Poker_by_PokerStars/,455020,casual  free to play  massively multiplayer  sports  strategy,free to play  sports  massively multiplayer  casual  strategy  gambling  card game,singleplayer  multiplayer  inapp purchases,Cooming Soon
http://store.steampowered.com/app/357720/Inside_My_Radio/,357720,action  casual  indie,indie  casual  action  rhythm  music  great soundtrack  colorful  platformer,singleplayer  steam achievements  full controller support  steam trading cards  steam cloud,14.99
http://store.steampowered.com/app/38922/Rhythm_Zone__Deep_Ocean_Visualizer/,38922,indie  casual,indie  casual,singleplayer  multiplayer  downloadable content  steam achievements  partial controller support  stats  steam leaderboards,0.99
http://store.steampowered.com/app/602660/Suspended_Workshops/,602660,no info available,indie  free to play  vr,singleplayer  steam achievements  htc vive  tracked motion controllers  seated  standing  roomscale,Cooming Soon
http://store.steampowered.com/app/210084/Street_Fighter_X_Tekken_SF_Booster_Pack_4/,210084,action,action,singleplayer  multiplayer  coop  downloadable content,0.99
http://store.steampowered.com/app/419932/GGXrd_System_Voice__INO/,419932,action,action,singleplayer  multiplayer  downloadable content  steam achievements  full controller support  steam trading cards  steam cloud  steam leaderboards,0.99
http://store.steampowered.com/app/447480/TANE_DLC_NS_SD60E_First_Responders/,447480,simulation,simulation,singleplayer  multiplayer  coop  downloadable content,15.99
http://store.steampowered.com/app/292330/Starship_Corporation/,292330,indie  simulation  strategy  early access,early access  simulation  strategy  indie  management  space,singleplayer,19.99
http://store.steampowered.com/app/412990/The_Escapists__Santas_Sweatshop/,412990,action  adventure  indie  simulation  strategy,strategy  action  adventure  simulation  indie  free to play  pixel graphics  singleplayer  funny,singleplayer  downloadable content  steam achievements  steam trading cards  steam workshop  steam cloud  steam leaderboards,Free to Play
http://store.steampowered.com/app/33550/Time_of_Shadows/,33550,action  rpg,action  rpg,singleplayer  multiplayer,9.99
http://store.steampowered.com/app/688274/BLUE_REFLECTION_Bonus_Costume_Nightless_Saber/,688274,rpg,rpg,singleplayer  downloadable content  steam achievements  partial controller support,Cooming Soon
http://store.steampowered.com/app/773470/Freestyle_2__Silver_Fox_Star_Pack/,773470,action  casual  free to play  massively multiplayer  sports,action  free to play  massively multiplayer  casual  sports,singleplayer  multiplayer  mmo  coop  downloadable content  steam trading cards  partial controller support,64.99
http://store.steampowered.com/app/573890/Tim_Allen_ReWires_America/,573890,no info available,comedy  movie,captions available,2.99
http://store.steampowered.com/app/223000/7_Wonders_Ancient_Alien_Makeover/,223000,strategy  casual,casual  strategy  match 3  puzzle,singleplayer,9.99
http://store.steampowered.com/app/506450/Caf_Society/,506450,no info available,movie  romance  drama  comedy,captions available,3.99
http://store.steampowered.com/app/569510/The_Harvest_VR/,569510,casual  free to play,free to play  casual  horror  vr,singleplayer,Cooming Soon
http://store.steampowered.com/app/741390/___Igo_Meijin/,741390,casual  strategy,casual  strategy,singleplayer  multiplayer,79.99
http://store.steampowered.com/app/586280/Dima_Rescues_Ira/,586280,action  adventure  casual  indie,adventure  indie  casual  action  hidden object  singleplayer  2d  atmospheric  dark  horror  difficult  gore,singleplayer,2.99
http://store.steampowered.com/app/355420/FLAMBERGE/,355420,adventure  rpg  strategy  early access,early access  rpg  strategy  adventure  turnbased tactics  tactical rpg  indie  tactical  pixel graphics  partybased rpg  turnbased combat  great soundtrack  turnbased  fantasy  strategy rpg  turnbased strategy,singleplayer,9.99
http://store.steampowered.com/app/502750/Quest_for_Glory_15/,502750,adventure,adventure  1990's  1980s  rpg  classic  fantasy  pixel graphics  point & click  2d,singleplayer,9.99
http://store.steampowered.com/app/410050/The_Forgotten_Forest/,410050,adventure  indie,indie  adventure  rpgmaker  horror,singleplayer,0.99
http://store.steampowered.com/app/334520/eXceed_2nd__Vampire_REX_Original_Soundtrack/,334520,action,action,singleplayer  downloadable content  steam trading cards,7.99
http://store.steampowered.com/app/493650/Deep_Space_Dash/,493650,action  casual  indie,action  indie  casual  space  scifi  runner,singleplayer  steam achievements  steam trading cards  partial controller support,0.99
http://store.steampowered.com/app/489700/Battle_Forever/,489700,action  indie,action  indie  beat 'em up,singleplayer  full controller support  steam trading cards,1.99
http://store.steampowered.com/app/596270/Tales_of_Terror_Crimson_Dawn/,596270,adventure  casual,casual  adventure  hidden object,singleplayer,6.99
http://store.steampowered.com/app/677692/Ys_VIII_Lacrimosa_of_DANA__Digital_Soundtrack_Sampler/,677692,action  rpg,action  rpg,singleplayer  downloadable content  full controller support,Cooming Soon
http://store.steampowered.com/app/754930/Zero_Days_VR/,754930,no info available,indie  casual  vr  documentary  story rich  great soundtrack  cyberpunk  singleplayer  hacking  political  cinematic  female protagonist,singleplayer  htc vive  oculus rift  tracked motion controllers  keyboard / mouse  seated,9.99
http://store.steampowered.com/app/589600/DYE_Original_Soundtrack/,589600,action  adventure  indie,action  adventure  indie,singleplayer  downloadable content,4.99
http://store.steampowered.com/app/44600/GTR__FIA_GT_Racing_Game/,44600,racing  sports,racing  sports  simulation,singleplayer  multiplayer,6.99
http://store.steampowered.com/app/421830/Indivisible_Prototype_Demo/,421830,action  indie  rpg,indie  rpg  action  female protagonist  platformer  metroidvania,singleplayer  game demo  full controller support,Cooming Soon
http://store.steampowered.com/app/319290/Lords_of_Xulima__Special_Digital_Rewards/,319290,adventure  indie  rpg,rpg  indie  adventure,singleplayer  downloadable content  steam achievements  steam trading cards  steam workshop  steam cloud  stats,6.99
http://store.steampowered.com/app/260230/Valiant_Hearts_The_Great_War__Soldats_Inconnus__Mmoires_de_la_Grande_Guerre/,260230,adventure,atmospheric  historical  world war i  adventure  war  story rich  2d  great soundtrack  puzzle  singleplayer  side scroller  platformer  action  comic book  education  music  indie  casual  point & click  rpg,singleplayer,14.99
http://store.steampowered.com/app/366010/Generic_Space_Shooter/,366010,action  indie,action  indie  space  shoot 'em up  shooter  topdown shooter  2d  pixel graphics  topdown  family friendly  difficult  singleplayer  colorful  great soundtrack  casual  fastpaced  game development  programming,singleplayer  full controller support,2.99
http://store.steampowered.com/app/446780/AMOK/,446780,action  adventure  indie,action  indie  adventure  horror  firstperson  shooter,singleplayer,0.99
http://store.steampowered.com/app/692660/Invictus_In_the_Shadow_of_Olympus/,692660,adventure  rpg  strategy,strategy  rpg  adventure,singleplayer  multiplayer,9.99
http://store.steampowered.com/app/718710/Command_Shifting_Sands/,718710,simulation  strategy,strategy  simulation,singleplayer,19.99
http://store.steampowered.com/app/386280/Vendetta__Curse_of_Ravens_Cry/,386280,action  indie  rpg,action  rpg  indie  pirates  open world  adventure  atmospheric  naval,singleplayer  steam achievements  full controller support  steam trading cards  steam cloud,29.99
http://store.steampowered.com/app/210896/Crusader_Kings_II_Byzantine_Unit_Pack/,210896,strategy,strategy,singleplayer  multiplayer  downloadable content,1.99
http://store.steampowered.com/app/455030/Save_the_Dodos_Soundtrack/,455030,casual  indie,indie  casual,singleplayer  downloadable content  steam trading cards,1.99
http://store.steampowered.com/app/384225/D4_Hand_Cursor_SetVol1/,384225,adventure  casual  indie,adventure  indie  casual,singleplayer  downloadable content  steam achievements  full controller support  steam trading cards  steam cloud,2.99
